{
  "run_id": "auth-acct-fixture",
  "tab_id": null,
  "timestamp": "2026-05-31T12:06:50Z",
  "kind": "auth-state",
  "severity": "info",
  "message": "auth state updated",
  "fields": {
    "state": "code-requested",
    "page_url": "https://chatgpt.com/",
    "composer_detected": "false",
    "code_requested": "true"
  }
}
